{
  "stage": "7d_meta",
  "schema_version": "1.0.0",
  "run_id": "benchmark_creativity_support",
  "branch_id": "b",
  "reviewers_read": [
    "methodologist",
    "accessibility_advocate"
  ],
  "disagreement_matrix": [
    {
      "reviewer": "methodologist",
      "recommendation": "major_revision",
      "decisive_weakness": "The causal claim about a 'meter-aware line-ending co-writer' cannot be tested because the co-writer and rhyming-dictionary conditions are confounded on delivery modality, curation source, and structure; additionally the wizard (a human prosody expert doing adaptive personalization in 4 seconds) is not a plausible stand-in for any deployable LM, so generalization to AI co-writing is unwarranted; plus the study is underpowered for its directional quantitative claim."
    },
    {
      "reviewer": "accessibility_advocate",
      "recommendation": "minor_revision",
      "decisive_weakness": "No decisive weakness from the accessibility lens — the study does not target a disabled population and is not paternalistic or extractive. Real but non-blocking gaps exist: visual-only stress annotation excludes blind formalist poets, written-scansion screening may under-detect aurally competent poets with dyslexia, compensation for screened-out participants is unstated, and the 120-minute fixed-desk session lacks break/split-session accommodation."
    }
  ],
  "disagreement_classification": "consensus",
  "verdict": "accept_revise",
  "verdict_rationale": "The two reviewers are within one recommendation level (major_revision vs. minor_revision) and their decisive concerns do not contradict each other. The methodologist blocks on confound architecture, construct validity of the wizard, and power — all concerns about whether the design can answer the causal question it poses. The accessibility_advocate explicitly states no decisive weakness is found from their lens and flags recruitment-accessibility gaps (screen-reader-incompatible stress glyphs, written-only scansion screen, session length) that are additive rather than opposed to the methodologist's required changes. Addressing the methodologist's required changes (adding a fourth condition or reframing, building a real generator, power analysis, theme counterbalancing, pre-locked outcome dimensions, blinding check) and the accessibility advocate's requests (aural screening option, accommodation statement, split-session option, compensation for screened-out participants) are compatible and do not force a design tradeoff against each other. This is a substantive major_revision, not a split requiring human judgment.",
  "provenance": {
    "meta": "AGENT_INFERENCE"
  }
}
